{"authorization":{"activation":false,"egress":false,"execution":false,"mutation":false},"coverage":{"bytes_read":145,"complete_within_policy":true,"entries_considered":1,"excluded_entries":0,"files_read":1,"limitations":[]},"discovery_outcome":"review_required","discovery_version":"python-static-capabilities-v1","engine_sha256":"2a2cff1d2cfb4c671c62dc9ed6cebbef886ce05659fc8e3c36293dc2cda46cd3","files":[{"configuration_sighting":false,"file":"opaque.py","language":"python","line_count":7,"mode":511,"parser":"python_ast","sha256":"b5e09a154d2b60b3663f7318390e8e01ef751c7eb307c653aa3d1a006c3de835","test_sighting":false}],"layouts":["flat_module"],"parser_identity":"cpython-3.12-ast","policy":{"exclude":[],"hard_real_time":[],"max_ast_nodes":50000,"max_depth":16,"max_entries":20000,"max_file_bytes":1000000,"max_files":1000,"max_report_bytes":4194304,"max_symbols":2000,"max_total_bytes":16777216},"registry_possibilities":[],"report_sha256":"dcae1a45c89028d6709c40097ed2c559225603a99b6029b5bb54141fef9ef060","repository_identity":"26e209970b4e059bb176b4db5a5b5b65d8466f297807d69bd97e2ef2cf3f999c","schema_version":"1.0","seams":[{"binding_review":"not_performed","eligibility":"unknown","execution_qualified":false,"kind":"function","module_level":true,"reasons":["legacy_recipe_preconditions_not_established"],"seam_id":"39b4909fde86aa80b8ab3d638956c3d0946326d92324573bc711af0fa8d0fa41","semantic_suitability":"unreviewed","shape":"unsupported_or_unresolved","source":{"ast_sha256":"e7c58127b24223eb193d0eae0a027db41aebbc15dd4b485bcb1e3d0dc0826d7f","end_line":2,"file":"opaque.py","file_sha256":"b5e09a154d2b60b3663f7318390e8e01ef751c7eb307c653aa3d1a006c3de835","qualified_symbol":"b","start_line":1}},{"binding_review":"not_performed","eligibility":"unknown","execution_qualified":false,"kind":"function","module_level":true,"reasons":[],"seam_id":"8b63378bb40c6ed6ce729f18928a4aaee3801bbe45a3a0dd81ea58defa0809aa","semantic_suitability":"unreviewed","shape":"module-tail-call-v1-preflight","source":{"ast_sha256":"f895f11b77e50f4385745857fc8ee2e2c8c086f45d2c5d0c726f99b0b98a503c","end_line":5,"file":"opaque.py","file_sha256":"b5e09a154d2b60b3663f7318390e8e01ef751c7eb307c653aa3d1a006c3de835","qualified_symbol":"q","start_line":4}}],"snapshot_scope":"bounded_source_and_configuration_not_full_repository","snapshot_sha256":"ca627ff3e0f508e93e3f2ef2777019526a86af5742fce866ac6a7e929ece43ae"}
