{"authorization":{"activation":false,"egress":false,"execution":false,"mutation":false},"coverage":{"bytes_read":408,"complete_within_policy":true,"entries_considered":1,"excluded_entries":0,"files_read":1,"limitations":[]},"discovery_outcome":"review_required","discovery_version":"python-static-capabilities-v1","engine_sha256":"2a2cff1d2cfb4c671c62dc9ed6cebbef886ce05659fc8e3c36293dc2cda46cd3","files":[{"configuration_sighting":false,"file":"opaque.py","language":"python","line_count":23,"mode":511,"parser":"python_ast","sha256":"8013b62e8b8e08b4552c8dafdb54230f936559721f4a16d142baf906eb1141ec","test_sighting":false}],"layouts":["flat_module"],"parser_identity":"cpython-3.12-ast","policy":{"exclude":[],"hard_real_time":[],"max_ast_nodes":50000,"max_depth":16,"max_entries":20000,"max_file_bytes":1000000,"max_files":1000,"max_report_bytes":4194304,"max_symbols":2000,"max_total_bytes":16777216},"registry_possibilities":[],"report_sha256":"2ad5c2b97706d5c9051995bc99e9959730e3b6b0b84212da6c9ad5e186a201f7","repository_identity":"6d251d6fbe6e6d87c60d70186618aefee1a7c1f11d0a89643c0bab8c2ca52bc8","schema_version":"1.0","seams":[{"binding_review":"not_performed","eligibility":"unknown","execution_qualified":false,"kind":"function","module_level":true,"reasons":["legacy_recipe_preconditions_not_established"],"seam_id":"c0f3e38bce92c898de2b8051001855c7f8cf0e539453667d7e51fdd4d964840e","semantic_suitability":"unreviewed","shape":"unsupported_or_unresolved","source":{"ast_sha256":"05e10f8bc04fc58bea9e7864349faa1f7f4160060aee7c97b3507f47f38da2ab","end_line":7,"file":"opaque.py","file_sha256":"8013b62e8b8e08b4552c8dafdb54230f936559721f4a16d142baf906eb1141ec","qualified_symbol":"a17","start_line":4}},{"binding_review":"not_performed","eligibility":"unknown","execution_qualified":false,"kind":"function","module_level":true,"reasons":[],"seam_id":"10d5a7f1cd95524532b2a158dd30473974f2fcd1bb7033468398e23824be86f4","semantic_suitability":"unreviewed","shape":"module-tail-call-v1-preflight","source":{"ast_sha256":"dfbe33b8d04880aa1763a1ee9e8d8d36b9fac789081f4177c5e0a7e0087f451f","end_line":11,"file":"opaque.py","file_sha256":"8013b62e8b8e08b4552c8dafdb54230f936559721f4a16d142baf906eb1141ec","qualified_symbol":"z93","start_line":10}},{"binding_review":"not_performed","eligibility":"unknown","execution_qualified":false,"kind":"function","module_level":true,"reasons":["legacy_recipe_preconditions_not_established"],"seam_id":"f260f5ed31199aa174136f1363f01ffdee91f690700396e0d44180a2f909def0","semantic_suitability":"unreviewed","shape":"unsupported_or_unresolved","source":{"ast_sha256":"1f5bc315b1c387b84c38a59c3ababb2b8603694496924644cc47ee85bbb51f0f","end_line":15,"file":"opaque.py","file_sha256":"8013b62e8b8e08b4552c8dafdb54230f936559721f4a16d142baf906eb1141ec","qualified_symbol":"h04","start_line":14}},{"binding_review":"not_performed","eligibility":"unknown","execution_qualified":false,"kind":"function","module_level":true,"reasons":["legacy_recipe_preconditions_not_established"],"seam_id":"372f0953f3a1ae665405626c2f82f92e30a0b2655cf56e961984df9e41eaaa66","semantic_suitability":"unreviewed","shape":"unsupported_or_unresolved","source":{"ast_sha256":"4bfdc031fe4c968dcb08e47f732266a65172b0d9cf33c90b0861ba74f1119a76","end_line":19,"file":"opaque.py","file_sha256":"8013b62e8b8e08b4552c8dafdb54230f936559721f4a16d142baf906eb1141ec","qualified_symbol":"h09","start_line":18}},{"binding_review":"not_performed","eligibility":"ineligible","execution_qualified":false,"kind":"function","module_level":true,"reasons":["deterministic_operation_shape","legacy_recipe_preconditions_not_established"],"seam_id":"04fbcd8367d17d6f18434932b4c641d668f78ceac3d3ce51edc2f7267525bef5","semantic_suitability":"unreviewed","shape":"unsupported_or_unresolved","source":{"ast_sha256":"aef61e0935889f4737f95434745a7035f56d67d503d972df0cb3eedb602b8c62","end_line":23,"file":"opaque.py","file_sha256":"8013b62e8b8e08b4552c8dafdb54230f936559721f4a16d142baf906eb1141ec","qualified_symbol":"r22","start_line":22}}],"snapshot_scope":"bounded_source_and_configuration_not_full_repository","snapshot_sha256":"93b9317073709c9a9afa323ec349ea2d56fa6753b87ff82c507b5e59a26ed179"}
